title,stream,description,required_skills,min_education,salary_range,type,difficulty,market_demand
Software Engineer,Engineering/Technology,Design development and testing of software applications. Solve programming challenges.,Python;JavaScript;SQL;Git;Algorithms;Data Structures,Undergraduate (B.Tech/BCA/B.Sc),400000 - 1800000,Private Sector,Hard,High
Data Scientist,Science/Computer Applications,Analyze data sets to extract insights and build predictive machine learning models.,Python;Machine Learning;SQL;Pandas;NumPy;Data Visualization,Undergraduate (B.Sc/BCA/B.Tech),600000 - 2400000,Private Sector,Hard,High
Chartered Accountant (CA),Commerce/Management,Manage financial accounts audit reports tax returns and corporate strategies.,Taxation;Auditing;Accounting Standards;Excel;Financial Analysis,B.Com/BBA + ICAI Exam,700000 - 2000000,Private Sector,Hard,High
UX/UI Designer,Design/Arts,Design interface and user experiences for apps and website interfaces.,Figma;Prototyping;Wireframing;UX Design;Visual Communication,Undergraduate (B.Des/BFA/Arts),400000 - 1200000,Private Sector,Medium,High
Civil/Structural Engineer,Engineering/Technology,Plan and supervise construction projects such as bridges roads and structures.,AutoCAD;Structural Analysis;Project Management;Estimation,Undergraduate (B.Tech/Diploma),350000 - 900000,Private Sector,Medium,Moderate
Pharmacist,Pharmacy/Medical,Dispense medications advise patients on drug safety and oversee retail inventories.,Pharmacology;Drug Chemistry;Inventory;Regulations;Customer Service,Undergraduate (B.Pharm/D.Pharm),250000 - 650000,Private Sector,Medium,High
Corporate Lawyer,Law,Advise businesses on mergers contract compliance and coordinate court filings.,Contract Drafting;Corporate Law;Litigation;Legal Research;Negotiation,Undergraduate (LLB/BA-LLB),600000 - 1800000,Private Sector,Hard,High
Agricultural Consultant,Agriculture/Science,Consult soil quality crop yields water resources and sustainable policies.,Agronomy;Soil Science;Pest Management;Sustainability;Irrigation,Undergraduate (B.Sc Agriculture),300000 - 700000,Private Sector,Medium,Growing
Secondary School Teacher,Education/Humanities,Plan lessons grade tests and manage classroom courses for secondary classes.,Classroom Management;Lesson Planning;Communication;Evaluation,Undergraduate + B.Ed,300000 - 650000,Government Sector,Medium,Stable
Hotel Manager,Hotel Management/Vocational,Supervise daily operations of a hotel resort kitchen procurement and staff.,Hospitality Management;Operations;Budgeting;Customer Relations;Staffing,Undergraduate (BHM/Hospitality),400000 - 1000000,Private Sector,Medium,Growing
Cloud Architect,Engineering/Technology,Design and implement enterprise cloud strategy cloud infrastructures and manage cloud migrations.,Cloud Computing;AWS;Azure;Kubernetes;Docker;DevOps,Undergraduate (B.Tech/BCA/B.Sc),600000 - 2200000,Private Sector,Hard,High
Digital Marketer,Commerce/Management,Plan and execute online advertising campaigns search engine optimization and social media branding.,SEO;SEM;Google Analytics;Content Writing;Social Media Marketing;Copywriting,Undergraduate (BBA/B.Com/B.A),300000 - 1200000,Private Sector,Medium,High
Graphic Designer,Design/Arts,Create visual concepts marketing designs illustrations and company brand logos.,Photoshop;Illustrator;InDesign;Typography;Branding;Creativity,Undergraduate (B.Des/BFA/Diploma),250000 - 900000,Private Sector,Medium,Growing
Product Manager,Commerce/Management,Define product roadmap manage software lifecycle coordinates engineering and marketing teams.,Agile;Product Strategy;User Research;Jira;Analytics;Roadmapping,Undergraduate + MBA,800000 - 2600000,Private Sector,Hard,High
Financial Analyst,Commerce/Management,Perform financial modeling evaluate investment opportunities analyze corporate statements and assess market risks.,Financial Modeling;Excel;Valuation;Accounting;Python;Analytical Thinking,Undergraduate (B.Com/BBA/B.Sc),400000 - 1500000,Private Sector,Hard,Growing
HR Specialist,Commerce/Management,Manage employee recruitment talent acquisition workplace policies employee relations and performance evaluations.,Recruiting;Interpersonal Skills;HR Policy;Conflict Resolution;Negotiation,Undergraduate (BBA/B.Com/B.A),300000 - 900000,Private Sector,Easy,Stable
Doctor,Medical/Pharmacy,Diagnose patient illnesses prescribe pharmaceutical medications execute surgical treatments and consult healthcare options.,Clinical Medicine;Surgery;Patient Diagnosis;Therapeutics;Healthcare Regulations,MBBS/MD,800000 - 3000000,Private Sector,Hard,High
Mechanical Engineer,Engineering/Technology,Design mechanical machinery optimize automotive equipment manage factory logistics and test manufacturing parts.,CAD;SolidWorks;Thermodynamics;Fluid Mechanics;Manufacturing Processes,Undergraduate (B.Tech),350000 - 1100000,Private Sector,Hard,Moderate
Content Writer,Humanities/Arts,Write engaging article text blog posts marketing copies and digital web content for brands and publications.,Content Writing;Copywriting;SEO;Research;Editing;Blogging;Creative Writing,Undergraduate (B.A. English/Humanities/Journalism),250000 - 700000,Private Sector,Easy,Growing
Clinical Psychologist,Humanities/Arts,Diagnose and treat mental emotional and behavioral disorders. Conduct counseling sessions and clinical assessments.,Clinical Psychology;Counseling;Patient Care;Active Listening;Emotional Intelligence;Mental Health Regulations,Postgraduate (M.A./M.Sc Psychology) & M.Phil,400000 - 1200000,Private Sector,Hard,High
Chef / Culinary Artist,Hotel Management/Vocational,Plan menus prepare high-quality culinary dishes supervise kitchen staff and oversee food safety in commercial kitchens.,Culinary Arts;Menu Planning;Kitchen Operations;Food Safety;Recipe Development;Plating,Undergraduate (BHM / Diploma in Culinary Arts),300000 - 1500000,Private Sector,Medium,Growing
Industrial Electrician,Hotel Management/Vocational,Install maintain and repair electrical systems heavy machinery controls and wiring in industrial settings.,Electrical Wiring;Troubleshooting;PLC Systems;Blueprint Reading;Safety Standards;Industrial Equipment,ITI Certification / Diploma in Electrical Engineering,200000 - 550000,Private Sector,Medium,Stable
Database Administrator,Science/Computer Applications,Configure manage monitor and optimize database management systems (DBMS) to ensure high-performance security and data integrity.,SQL;Database Administration;Backup & Recovery;Performance Tuning;Security Compliance;Oracle;PostgreSQL,Undergraduate (BCA/B.Sc CS/B.Tech),500000 - 1400000,Private Sector,Medium,Stable
Cybersecurity Analyst,Engineering/Technology,Protect organization networks firewalls and data assets from cyber threats malware hacking attacks and security vulnerabilities.,Network Security;Penetration Testing;Threat Intelligence;Firewalls;Linux;Cryptography;Incident Response,Undergraduate (B.Tech/BCA/B.Sc CS),500000 - 1600000,Private Sector,Hard,High
Fashion Designer,Design/Arts,Sketch fashion designs select textile fabrics create custom clothing apparel and accessories and present runway lines.,Fashion Design;Sketching;Textile Selection;Pattern Making;Sewing;Trend Analysis;Creativity,Undergraduate (B.Des Fashion / Diploma in Fashion Tech),250000 - 950000,Private Sector,Medium,Growing

Machine Learning Engineer,Science/Computer Applications,Design build and deploy machine learning models and artificial intelligence systems to solve complex business problems.,Python;Machine Learning;Deep Learning;SQL;PyTorch;TensorFlow,Undergraduate (B.Tech/BCA/B.Sc CS),₹800000 - ₹2500000,Private Sector,Hard,High
Investment Banker,Commerce/Management,Advise corporations and governments on financial strategies execute mergers and acquisitions and raise capital through debt and equity.,Financial Modeling;Investment Valuation;Excel;Analytical Thinking;Corporate Finance,Undergraduate + MBA (Finance) / CFA,₹1000000 - ₹3500000,Private Sector,Hard,High
Veterinarian,Medical/Pharmacy,Diagnose treat and prevent illnesses and injuries in domestic animals livestock and wildlife. Perform veterinary surgeries.,Animal Care;Clinical Medicine;Veterinary Surgery;Pharmacology;Pathology,Undergraduate (BVSc & AH),₹400000 - ₹1200000,Private Sector,Hard,High
Architect,Design/Arts,Plan design and supervise the construction of residential commercial and public buildings. Ensure aesthetic and structural feasibility.,AutoCAD;SketchUp;Revit;Architectural Design;Space Planning;Blueprint Reading,Undergraduate (B.Arch),₹400000 - ₹1500000,Private Sector,Hard,Moderate
Human Rights Lawyer,Law,Advocate for civil liberties defend human rights cases in courts consult NGOs and draft legal policies to protect vulnerable groups.,Constitutional Law;Legal Advocacy;Public Speaking;Legal Writing;Research,Undergraduate (LLB/BA-LLB),₹350000 - ₹1000000,NGO / Public Sector,Hard,Stable

Blockchain Developer,Engineering/Technology,Develop and implement secure blockchain protocols smart contracts and decentralized applications (dApps).,Solidity;Cryptography;Go;Rust;Web3.js;Smart Contracts,Undergraduate (B.Tech/BCA/B.Sc CS),₹60000 - ₹2200000,Private Sector,Hard,High
DevOps Engineer,Engineering/Technology,Bridge the gap between software development and IT operations by automating builds deployments and cloud infrastructure.,Linux;Docker;Kubernetes;CI/CD;AWS;Terraform;Ansible,Undergraduate (B.Tech/BCA/B.Sc CS),₹500000 - ₹1800000,Private Sector,Hard,High
Embedded Systems Engineer,Engineering/Technology,Design develop and test firmware and software that runs on electronic microcontrollers and hardware modules.,Embedded C;C++;Microcontrollers;RTOS;Microelectronics;Firmware;Oscilloscopes,Undergraduate (B.Tech ECE/EEE/CS),₹400000 - ₹1400000,Private Sector,Hard,Moderate
Game Developer,Engineering/Technology,Code game logic physics engines and graphics rendering using specialized frameworks and engines like Unity or Unreal.,C#;C++;Unity;Unreal Engine;Mathematics;Physics;Game Loop,Undergraduate (B.Tech/BCA/B.Sc CS),₹350000 - ₹1500000,Private Sector,Hard,Growing
Data Engineer,Engineering/Technology,Build optimize and maintain data pipelines ETL architectures and data warehouses to store and process large volumes of data.,SQL;Python;Spark;Hadoop;ETL Pipelines;Data Warehousing;Airflow,Undergraduate (B.Tech/BCA/B.Sc CS),₹550000 - ₹2000000,Private Sector,Hard,High
Site Reliability Engineer (SRE),Engineering/Technology,Apply software engineering practices to infrastructure and operations problems to build highly scalable and ultra-reliable software systems.,Python;Go;Kubernetes;Cloud Administration;Monitoring;Incident Response;Automation,Undergraduate (B.Tech/BCA/B.Sc CS),₹700000 - ₹2400000,Private Sector,Hard,High
Robotics Engineer,Engineering/Technology,Design build program and maintain automated machines industrial robots and autonomous vehicle control systems.,ROS (Robot Operating System);Python;C++;Microcontrollers;Kinematics;Control Systems;CAD,Undergraduate (B.Tech Robotics/Mechatronics/ECE/CS),₹450000 - ₹1600000,Private Sector,Hard,Growing
Cloud Security Specialist,Engineering/Technology,Secure enterprise cloud environments implement access management controls and protect cloud infrastructure from security breaches.,Cloud Security;IAM;AWS Security;Network Security;Compliance;Vulnerability Assessment,Undergraduate (B.Tech/BCA/B.Sc CS),₹600000 - ₹2000000,Private Sector,Hard,High
IoT Engineer,Engineering/Technology,Design and program connected physical devices sensors and communication gateways that transmit data over networks.,IoT Protocols (MQTT CoAP);Embedded Systems;Python;C++;Network Communication;Cloud Integration,Undergraduate (B.Tech ECE/EEE/CS),₹400000 - ₹1200000,Private Sector,Medium,Growing
Full Stack Developer,Engineering/Technology,Build both the user-facing frontend and the server-side backend logic of responsive modern web applications.,React;Node.js;Express;HTML;CSS;JavaScript;SQL;MongoDB;REST APIs,Undergraduate (B.Tech/BCA/B.Sc CS),₹450000 - ₹1800000,Private Sector,Hard,High
Bioinformatics Specialist,Science/Computer Applications,Analyze genomic data sets biological structures and sequencing records using computational and statistical models.,Python;R;Genomics;Bioinformatics Databases;Statistics;Sequence Alignment,Undergraduate (B.Sc Bioinformatics/Biotech/CS),₹400000 - ₹1100000,Private Sector,Hard,Growing
Quantitative Analyst,Science/Computer Applications,Design mathematical and statistical algorithms for stock pricing portfolio allocation and risk management in financial firms.,Quantitative Finance;Python;C++;Statistics;Stochastic Calculus;Excel;Financial Modeling,Undergraduate (B.Sc Math/Stats/B.Tech/BCA),₹80000 - ₹3000000,Private Sector,Hard,High
AI Research Scientist,Science/Computer Applications,Conduct research on new neural network architectures generative models and advanced machine learning theories.,Machine Learning;Deep Learning;PyTorch;Mathematical Modeling;Research Writing;Algorithms,Postgraduate (M.Sc/M.Tech/Ph.D.),₹100000 - ₹3500000,Private Sector,Hard,High
Forensic Scientist,Science/Computer Applications,Collect examine and analyze physical and digital evidence related to criminal investigations.,Analytical Chemistry;DNA Profiling;Toxicology;Microscopic Examination;Crime Scene Investigation,Undergraduate (B.Sc Forensic Science/Chemistry/BCA),₹30000 - ₹80000,Government Sector,Medium,Stable
GIS Specialist,Science/Computer Applications,Build analyze and maintain geographical maps and datasets using Geographic Information Systems software.,QGIS;ArcGIS;Python;Spatial Data Analysis;Cartography;Database Management,Undergraduate (B.Sc Geoinformatics/Geography/BCA/B.Sc CS),₹350000 - ₹900000,Private Sector,Medium,Growing
Microbiologist,Science/Computer Applications,Study microscopic organisms including bacteria viruses fungi and protozoa to understand their roles in disease and ecology.,Aseptic Techniques;Microbial Culturing;Microscopy;PCR;Biosafety Protocols,Undergraduate (B.Sc Microbiology/Biotech),₹30000 - ₹750000,Private Sector,Medium,Stable
Astrophysicist,Science/Computer Applications,Study the physical properties and dynamics of stars galaxies black holes and the universe using telescopes and physics simulations.,Physics;Calculus;Python;Data Analytics;Astronomy;Mathematical Simulation,Postgraduate / Ph.D. (Physics/Astronomy),₹50000 - ₹1800000,Government Sector,Hard,Stable
Statistician,Science/Computer Applications,Apply mathematical statistics to collect analyze and present quantitative data to solve real-world problems in business and research.,Probability;Statistical Modeling;R;SAS;Excel;Data Analysis;Hypotheses Testing,Undergraduate (B.Sc Statistics/Mathematics),₹40000 - ₹1500000,Private Sector,Medium,Growing
Environmental Scientist,Science/Computer Applications,Study environmental pollution sample water/soil qualities and construct reports to protect ecosystems and human health.,Soil Sampling;Chemistry;Impact Assessment;Sustainability;GIS;Lab Analysis,Undergraduate (B.Sc Environmental Science/Chemistry/Biology),₹30000 - ₹900000,NGO / Public Sector,Medium,Growing
Geologist,Science/Computer Applications,Study the composition structure and physical history of the Earth to discover mineral resources oil fields and map seismic hazards.,Mineralogy;Structural Geology;Field Mapping;GIS;Sedimentology;Safety Standards,Undergraduate (B.Sc Geology/Earth Sciences),₹40000 - ₹1200000,Private Sector,Medium,Stable
Risk Manager,Commerce/Management,Identify analyze and manage potential financial operational and regulatory risks that could impact business entities.,Risk Assessment;Financial Analysis;Compliance;Excel;Market Risk;Analytical Thinking,Undergraduate (B.Com/BBA/B.Sc Math),₹50000 - ₹1800000,Private Sector,Hard,Growing
Supply Chain Analyst,Commerce/Management,Analyze logistics inventory management and vendor relationships to optimize company supply chain cost and efficiency.,Data Analysis;Excel;Logistics;Supply Chain Management;Inventory Control;SAP,Undergraduate (B.Com/BBA/B.Tech),₹350000 - ₹1100000,Private Sector,Medium,High
Brand Manager,Commerce/Management,Define corporate brand guidelines lead product packaging design and execute advertising campaigns to drive market shares.,Brand Strategy;Market Research;Advertising;Marketing;Analytics;Communication,Undergraduate + MBA (Marketing),₹60000 - ₹2000000,Private Sector,Medium,High
Business Development Manager,Commerce/Management,Identify business partnerships pitch corporate products to prospects and expand client relationships to grow company revenues.,B2B Sales;Lead Generation;Negotiation;CRM (Salesforce);Presentation;Interpersonal Skills,Undergraduate (BBA/B.Com/B.A),₹40000 - ₹1500000,Private Sector,Medium,High
Management Consultant,Commerce/Management,Advise organizational managers on cost reductions business restructuring and process efficiencies.,Case Analysis;Business Strategy;Problem Solving;Presentation;Excel;Slide Design,Undergraduate + MBA (from premier institutes),₹80000 - ₹260000,Private Sector,Hard,High
Investment Analyst,Commerce/Management,Evaluate financial statements stock market indicators and macroeconomic charts to recommend buy/sell assets for funds.,Financial Analysis;Equity Research;Financial Modeling;Valuations;Excel;SEC Filings,Undergraduate (B.Com/BBA/B.Sc Finance),₹50000 - ₹1600000,Private Sector,Hard,High
E-commerce Manager,Commerce/Management,Coordinate website retail inventories manage product uploads optimize checkout conversion rates and run digital sales campaigns.,Shopify;Google Analytics;Digital Marketing;Inventory Management;Customer Acquisition;A/B Testing,Undergraduate (B.Com/BBA/B.A),₹40000 - ₹1300000,Private Sector,Medium,High
Tax Advisor,Commerce/Management,Consult corporate clients or private individuals on filing income tax returns using legal deductions and minimizing tax liabilities.,Tax Laws (GST/Direct Tax);Accounting;Financial Auditing;Excel;Legal Compliance,Undergraduate (B.Com/BBA) / CA,₹350000 - ₹1200000,Private Sector,Hard,Stable
Public Relations Specialist,Commerce/Management,Draft corporate press releases coordinate media interviews and manage company reputation during public relations crises.,Media Relations;Press Releases;Crisis Communication;Copywriting;Public Relations;Interpersonal Skills,Undergraduate (B.A. Journalism/BBA/B.Com),₹30000 - ₹1000000,Private Sector,Easy,Stable
Financial Planner,Commerce/Management,Consult individual clients on retirement savings life insurance purchases tax planning and mutual fund asset allocations.,Investment Advisory;Financial Planning;Wealth Management;Excel;Communication;Market Knowledge,Undergraduate (B.Com/BBA) & CFP Certification,₹350000 - ₹1100000,Private Sector,Medium,Growing
3D Animator,Design/Arts,Create moving digital characters physics simulations and environments for cinematic video games and commercial animations.,Maya;Blender;3D Modeling;Rigging;Physics;Visual Storytelling;Keyframing,Undergraduate (B.Des/BFA/Diploma in Animation),₹30000 - ₹1200000,Private Sector,Medium,Growing
Art Director,Design/Arts,Lead the visual style and themes of advertising campaigns magazines movie sets or video game projects.,Visual Communication;Design Leadership;Creative Direction;Typography;Adobe Suite;Concept Art,Undergraduate (B.Des/BFA/Fine Arts),₹60000 - ₹2200000,Private Sector,Hard,Stable
Interior Designer,Design/Arts,Plan spatial layouts pick custom furniture colors lighting fixtures and materials for residential and commercial building interiors.,AutoCAD;SketchUp;Space Planning;Materials;Lighting;Color Theory;Blueprint Reading,Undergraduate (B.Des Interior/Diploma in Interior Design),₹30000 - ₹1000000,Private Sector,Medium,Growing
Game Designer,Design/Arts,Draft game rule books design levels plan combat math systems and map overall user progression journeys.,Level Design;Game Mechanics;Narrative Design;Prototyping;Scripting;Game Balancing,Undergraduate (B.Des Game Design/BCA/B.A),₹40000 - ₹1400000,Private Sector,Medium,Growing
Industrial Designer,Design/Arts,Design physical mass-produced products like consumer appliances toy concepts medical equipment and automotive hulls.,SolidWorks;Keyshot;Concept Sketching;Ergonomics;Manufacturing Materials;Prototyping,Undergraduate (B.Des Product/Industrial Design),₹40000 - ₹1200000,Private Sector,Hard,Stable
Motion Graphics Designer,Design/Arts,Animate graphic shapes kinetic typography and logo designs for advertisements film intros and web apps.,After Effects;Illustrator;Photoshop;Motion Principles;Video Editing;Sound Design,Undergraduate (B.Des/BFA/Diploma in Graphic Design),₹30000 - ₹1000000,Private Sector,Medium,High
Textile Designer,Design/Arts,Create design patterns print layouts and weave structures for apparel fabrics carpets and interior linens.,Pattern Design;Textile Weaving;Photoshop;Illustrator;Dyeing Processes;Material Sciences,Undergraduate (B.Des Textile Design/Diploma in Fashion Tech),₹250000 - ₹900000,Private Sector,Medium,Stable
Exhibition Designer,Design/Arts,Design public exhibition stalls museum galleries trade show booths and retail merchandise displays.,AutoCAD;3D Rendering;Spatial Layout;Lighting;Material Specs;Brand Integration,Undergraduate (B.Des/B.Arch/Fine Arts),₹30000 - ₹1000000,Private Sector,Medium,Stable
Intellectual Property (IP) Lawyer,Law,Advise clients on patent registrations register corporate trademarks defend copyrights and litigate IP infringement disputes.,Patent Law;Trademark Filing;Copyright Act;Legal Writing;Litigation;Negotiation,Undergraduate (LLB/BA-LLB),₹50000 - ₹2200000,Private Sector,Hard,High
Environmental Lawyer,Law,Represent environmental groups advice corporate clients on carbon/waste regulations and litigate climate conservation filings in tribunals.,Environmental Laws;NGT Rules;Public Interest Litigation (PIL);Research;Legal Advocacy,Undergraduate (LLB/BA-LLB),₹40000 - ₹1200000,NGO / Public Sector,Hard,Growing
Criminal Lawyer,Law,Defend or prosecute individuals accused of criminal violations conduct cross-examinations and manage bail trials.,Criminal Procedure (CrPC);IPC;Cross-Examination;Criminal Defense;Oral Advocacy;Investigation,Undergraduate (LLB/BA-LLB),₹30000 - ₹1800000,NGO / Public Sector,Hard,Stable
Cyber Lawyer,Law,Advise clients on data privacy compliance prosecute online financial fraud cases and represent data leak disputes.,Information Technology Act;Data Privacy Laws;Digital Evidence;Cybersecurity;Legal Drafting,Undergraduate (LLB/BA-LLB) / Diploma in Cyber Law,₹40000 - ₹1600000,Private Sector,Hard,High
Dentist,Medical/Pharmacy,Diagnose and treat dental diseases perform teeth restorations oral surgeries and fit cosmetic prosthetics.,Oral Diagnosis;Dental Surgery;Orthodontics;Patient Care;Medical Hygiene;Clinical Diagnosis,Undergraduate (BDS),₹30000 - ₹120000,Private Sector,Hard,Stable
Physiotherapist,Medical/Pharmacy,Rehabilitate patients recovering from physical injuries surgeries or chronic movement disorders using physical exercises.,Physiotherapy;Anatomy;Kinesiology;Injury Rehabilitation;Patient Care;Exercise Therapy,Undergraduate (BPT),₹250000 - ₹800000,Private Sector,Medium,Growing
Clinical Research Associate,Medical/Pharmacy,Supervise clinical drug trials verify hospital protocol compliance and monitor patient safety logs for pharmaceutical developers.,Clinical Trials;GCP Guidelines;Clinical Data Management;Pharmacology;Auditing,Undergraduate (B.Pharm/B.Sc Biotech/MBBS),₹350000 - ₹950000,Private Sector,Medium,Growing
Epidemiologist,Medical/Pharmacy,Investigate patterns causes and transmission routes of infectious diseases in populations to define healthcare policies.,Epidemiology;Biostatistics;Public Health;Data Analysis;Disease Control;Research Methods,Postgraduate (MPH / M.Sc Epidemiology),₹450000 - ₹1400000,Government Sector,Hard,Stable
Pharmacovigilance Specialist,Medical/Pharmacy,Monitor post-market pharmaceutical products log drug side-effects and file adverse event reports to safety commissions.,Drug Safety;Adverse Event Reporting;Medical Coding (MedDRA);Pharmacology;Database Management,Undergraduate (B.Pharm/M.Pharm/Pharm.D),₹30000 - ₹850000,Private Sector,Medium,Stable
Curriculum Designer,Education/Humanities,Design school course syllabi select textbooks and construct digital learning modules for academic schools.,Curriculum Design;Instructional Design;Lesson Planning;Educational Psychology;Content Development,Undergraduate + B.Ed / M.Ed,₹350000 - ₹900000,Private Sector,Medium,Stable
Event Planner,Hotel Management/Vocational,Coordinate venue bookings manage catering menus arrange decorators and supervise timelines for weddings and corporate conferences.,Event Management;Budgeting;Vendor Management;Customer Relations;Operations,Undergraduate (BHM/BBA/Diploma in Event Management),₹30000 - ₹1000000,Private Sector,Easy,Growing
Fitness Trainer,Hotel Management/Vocational,Design personalized strength routines consult client nutrition choices and lead group fitness classes in gyms.,Exercise Physiology;Strength Training;Nutrition;Client Coaching;First Aid/CPR,Higher Secondary + Certified Fitness Trainer certification,₹20000 - ₹700000,Private Sector,Easy,Growing




